<?xml version='1.0'  encoding='UTF-8' ?>
<!DOCTYPE RESULTS SYSTEM "resultados_todas_jornadas.dtd">
<RESULTS>
    <ROW>
        <COLUMN NAME="XML_DATA">
            <![CDATA[
            <Jornadas>
                <Jornada Codigo_Jornada="1" Numero_Jornada="1">
                    <Enfrentamiento>
                        <Codigo_Enfrentamiento>1</Codigo_Enfrentamiento>
                        <Equipo_Local>Team Alpha</Equipo_Local>
                        <Equipo_Visitante>Team Bravo</Equipo_Visitante>
                        <Ganador>Team Alpha</Ganador>
                    </Enfrentamiento>
                    <Enfrentamiento>
                        <Codigo_Enfrentamiento>2</Codigo_Enfrentamiento>
                        <Equipo_Local>Team Charlie</Equipo_Local>
                        <Equipo_Visitante>Team Delta</Equipo_Visitante>
                        <Ganador>Team Delta</Ganador>
                    </Enfrentamiento>
                </Jornada>
                <Jornada Codigo_Jornada="2" Numero_Jornada="2">
                    <Enfrentamiento>
                        <Codigo_Enfrentamiento>3</Codigo_Enfrentamiento>
                        <Equipo_Local>Team Alpha</Equipo_Local>
                        <Equipo_Visitante>Team Bravo</Equipo_Visitante>
                        <Ganador>Team Bravo</Ganador>
                    </Enfrentamiento>
                    <Enfrentamiento>
                        <Codigo_Enfrentamiento>4</Codigo_Enfrentamiento>
                        <Equipo_Local>Team Charlie</Equipo_Local>
                        <Equipo_Visitante>Team Delta</Equipo_Visitante>
                        <Ganador>Team Charlie</Ganador>
                    </Enfrentamiento>
                </Jornada>
            </Jornadas>
            ]]>
        </COLUMN>
    </ROW>
</RESULTS>
